{"archive_policy":{"entry_order":"lexicographic-bytewise","format":"ustar","mode_source":"manifest","timestamp":0},"binary_artifacts":[{"arch":"x64","bytes":206886674,"id":"app","install_path":"Bifrost.exe","kind":"exe","path":"windows-app/payload-1790830096-736/Bifrost.exe","platform":"windows","sha256":"bf3f8fc4b21ddf32aafa61aa362150f47aac0f37bd7c9fb8ee7ac02b6aa2a9d6"},{"arch":"x64","bytes":749,"id":"core-manifest","install_path":"cores/CORE-MANIFEST.json","kind":"core-manifest","path":"windows-service/payload-1790830096-736/cores/CORE-MANIFEST.json","platform":"windows","sha256":"0de25bf4cd1ae1458854105ec1538d3633edc9829e8cc409d337994026fd517b"},{"arch":"x64","bytes":8510129,"id":"geoip","install_path":"cores/geoip.metadb","kind":"core","path":"windows-service/payload-1790830096-736/cores/geoip.metadb","platform":"windows","sha256":"6eef2fedc2dae7091c112be13895968135ec01e702df2f5b4b1161b07d714720"},{"arch":"x64","bytes":4248636,"id":"geosite","install_path":"cores/GeoSite.dat","kind":"core","path":"windows-service/payload-1790830096-736/cores/GeoSite.dat","platform":"windows","sha256":"9ac232ceb7e350f31e05c0d1a973a4b12eab96726f7fc1b59cb052bc5c6519ca"},{"arch":"x64","bytes":364,"id":"install-metadata","install_path":"install-metadata.json","kind":"metadata","path":"windows-installer/payload-1790830096-736/install-metadata.json","platform":"windows","sha256":"40e9f8f9c95a28fda22a739f94cd47d891d9afcbbeb1bb1858fb28f09c869242"},{"arch":"x64","bytes":51937112,"id":"installer","install_path":"BifrostSetup.exe","kind":"installer","path":"windows-installer/payload-1790830096-736/BifrostSetup.exe","platform":"windows","sha256":"7d8c135c4f3891065856172eab84c418c9279f6b8f7d01c73b08d4688b90fcfe"},{"arch":"x64","bytes":50132992,"id":"mihomo","install_path":"cores/mihomo.exe","kind":"core","path":"windows-service/payload-1790830096-736/cores/mihomo.exe","platform":"windows","sha256":"6ac25fcb26afe8e1bea24b6e6e80805bf884a33232d12e2d78dfa0b6c529ac14"},{"arch":"x64","bytes":86139213,"id":"service","install_path":"BifrostClientService.exe","kind":"service-exe","path":"windows-service/payload-1790830096-736/BifrostClientService.exe","platform":"windows","sha256":"23afc4802cb9cdfba34c1616859cac67337bd1d68628da42803497638847f93a"}],"binary_artifacts_sha256":"4bd358870f1aed7d14af96c045f14c34c6e3cc760b080c474b3375f308950da3","build_inputs":{"format":"BIFROST-BUILD-INPUTS-1","input_sha256":"cece55dacf0c3e87cdfd9f76906288b71de5deed67f6ae071ca7479bbf2841a8","inputs":[{"bytes":23264,"kind":"source","mode":"644","path":"build-inputs/core/meta-rules-dat-4178770badecb1b349fbcd62c737e0d7a2079729.tar.gz","sha256":"6e8d87b0439cfe46618a55f0d8c90fea07450c59f586d1dab48d920f2e5db0a0"},{"bytes":1228535,"kind":"source","mode":"644","path":"build-inputs/core/mihomo-v1.19.30-source.tar.gz","sha256":"ee8a7107707e4bd485460139b1944e7be30016393783f2b4e928c14880c8ca8b"},{"bytes":993411,"kind":"toolchain","mode":"644","path":"build-inputs/evidence/dotnet-10.0-releases.json","sha256":"5e3f4d08e6be9724ee3407b10ca19e33b6e895d74b6f122651b8bcac22b54fdb"},{"bytes":635,"kind":"toolchain","mode":"644","path":"build-inputs/evidence/local-toolchain.json","sha256":"ade5f44656c65cf5c2faa2229dec17239ea58fe37a8625c969b72c7a1c08d494"},{"bytes":2967,"kind":"toolchain","mode":"644","path":"build-inputs/evidence/node-v24.19.0-SHASUMS256.txt","sha256":"be0629ee2bcd8e40bb856abdd3407f0762101b76bd60a36b8867f637733631c0"},{"bytes":18529108,"kind":"core","mode":"644","path":"build-work/toolchains/cores/downloads/mihomo-windows-amd64-compatible-v1.19.30.zip","sha256":"289fde5e29d37a5b3326480590d8b3551c5bf7f8737290355c19bce74d57a563"},{"bytes":8510129,"kind":"core","mode":"644","path":"build-work/toolchains/cores/mihomo-rules/2026-09-22/geoip.metadb","sha256":"6eef2fedc2dae7091c112be13895968135ec01e702df2f5b4b1161b07d714720"},{"bytes":4248636,"kind":"core","mode":"644","path":"build-work/toolchains/cores/mihomo-rules/2026-09-22/geosite.dat","sha256":"9ac232ceb7e350f31e05c0d1a973a4b12eab96726f7fc1b59cb052bc5c6519ca"},{"bytes":11813,"kind":"metadata","mode":"644","path":"repos/bifrost-clients/config-contracts/release-contract-v1.json","sha256":"f077f3ba0c9c1015c7355d1ddb2a9b7799996cdc452a96e33b9c84f3ecb1b3a5"},{"bytes":896,"kind":"metadata","mode":"644","path":"repos/bifrost-clients/core-adapters/mihomo-geodata.lock.json","sha256":"58996700d960e61e68ee0a7754a5370f849308f605985bf6a89531357ee479dc"},{"bytes":572,"kind":"metadata","mode":"644","path":"repos/bifrost-clients/core-adapters/mihomo.lock.json","sha256":"01a4d9080c8c5e521b893864909392253316044709663f1738d2342e59028641"},{"bytes":590,"kind":"source","mode":"644","path":"repos/bifrost-clients/release/ReleaseArtifactPolicy.cs","sha256":"f39bda8c4a078d776d8b59092f69ec51014d788e6b994b341cb9e4ffdcd54e3c"},{"bytes":143754,"kind":"source","mode":"644","path":"repos/bifrost-clients/release/ReleaseUpdateManager.cs","sha256":"e32bda66db2fd58d44e1234b8b8615881c771b126d095069e041759e771472e0"},{"bytes":14126,"kind":"source","mode":"644","path":"repos/bifrost-clients/windows-app/BifrostApp.csproj","sha256":"da484381ceb5de45bd9404655ed53e537504c2881e647a356f59d821e97ad5d2"},{"bytes":28760,"kind":"lock","mode":"644","path":"repos/bifrost-clients/windows-app/obj/project.assets.json","sha256":"edb8cb2e807256e9bb60eba0a29255ca52bbc3a09535edd05e7328802a80ccd3"},{"bytes":5451,"kind":"source","mode":"644","path":"repos/bifrost-clients/windows-service/BifrostClientService.csproj","sha256":"75c76da8a3b39b8edba6ec7c77dd9ebbdec2136b97e5f9996daf0d9be8efb1f9"},{"bytes":34564,"kind":"lock","mode":"644","path":"repos/bifrost-clients/windows-service/obj/project.assets.json","sha256":"6c736a47a23ee63f44aa6d6bd6a1988bb82548d555fe7cd4035c70edcf6ce9a6"},{"bytes":6471,"kind":"source","mode":"644","path":"repos/bifrost-infra/installer/BifrostSetup.csproj","sha256":"eb0c4a53adfea51bc26f9a3285bf8c205f7612924c568bf36a4e02cd9291f6c6"},{"bytes":25796,"kind":"lock","mode":"644","path":"repos/bifrost-infra/installer/obj/project.assets.json","sha256":"1a5284a284fdb53b3d00b885fd51e0692404de3fc724ab8b4385ca5fb11a2b60"},{"bytes":46358,"kind":"script","mode":"755","path":"repos/bifrost-infra/scripts/build-clients.ps1","sha256":"cc1335711a0795c1db162fd239e976cc7ddbee5214f018572c518043f08a17c6"},{"bytes":7627,"kind":"script","mode":"755","path":"repos/bifrost-infra/scripts/setup-core-binaries.ps1","sha256":"30431e2651036cfccb9118f2000f1c0628bf63b09631a28850a44da9bc3c88bc"}],"toolchain":{"required":[{"download_url":"https://dotnetcli.blob.core.windows.net/dotnet/release-metadata/10.0/releases.json","name":".NET SDK release metadata","sha256":"5e3f4d08e6be9724ee3407b10ca19e33b6e895d74b6f122651b8bcac22b54fdb","version":"10.0.302"},{"download_url":"https://nodejs.org/dist/v24.19.0/SHASUMS256.txt","name":"Node.js release checksums","sha256":"be0629ee2bcd8e40bb856abdd3407f0762101b76bd60a36b8867f637733631c0","version":"24.19.0"}]}},"build_inputs_sha256":"cece55dacf0c3e87cdfd9f76906288b71de5deed67f6ae071ca7479bbf2841a8","build_plan_sha256":"4bd358870f1aed7d14af96c045f14c34c6e3cc760b080c474b3375f308950da3","core_provenance":{"format":"BIFROST-CORE-PROVENANCE-1","input_sha256":"4291671922e94196016f0f59a664a65fdfb5b849f3c14aef3035eb25783af8ad","mihomo":{"patch_digest":"a493ba0abe3182116beec13fa5abc892411ae0b8d61e5796897c9a36a0e13917","patch_path":"build-inputs/core/mihomo-NO-PATCH.txt","source_digest":"ee8a7107707e4bd485460139b1944e7be30016393783f2b4e928c14880c8ca8b","source_path":"build-inputs/core/mihomo-v1.19.30-source.tar.gz","version":"1.19.30"},"overlay":[{"bytes":160,"path":"build-inputs/core/mihomo-NO-PATCH.txt","sha256":"a493ba0abe3182116beec13fa5abc892411ae0b8d61e5796897c9a36a0e13917"}],"patches_digest":"a493ba0abe3182116beec13fa5abc892411ae0b8d61e5796897c9a36a0e13917","source_archive":[{"bytes":1228535,"path":"build-inputs/core/mihomo-v1.19.30-source.tar.gz","sha256":"ee8a7107707e4bd485460139b1944e7be30016393783f2b4e928c14880c8ca8b"},{"bytes":23264,"path":"build-inputs/core/meta-rules-dat-4178770badecb1b349fbcd62c737e0d7a2079729.tar.gz","sha256":"6e8d87b0439cfe46618a55f0d8c90fea07450c59f586d1dab48d920f2e5db0a0"}]},"core_provenance_sha256":"4291671922e94196016f0f59a664a65fdfb5b849f3c14aef3035eb25783af8ad","dependency_license_manifest":{"components":[{"bom_ref":"bifrost","copyright":"Copyright Bifrost contributors","license_expression":"GPL-3.0-only","modified":true,"notice":"Bifrost client components are distributed under GPL-3.0-only; complete license text is bundled.","purl":"pkg:generic/bifrost","source":"repos/bifrost-clients"},{"bom_ref":"bifrost-client-runtime@release-bound","copyright":"Copyright Bifrost contributors","license_expression":"GPL-3.0-only","modified":true,"notice":"Bifrost native client runtime is release-bound and distributed under GPL-3.0-only.","purl":"pkg:generic/bifrost-client-runtime@release-bound","source":"repos/bifrost-clients/windows-app;repos/bifrost-clients/windows-service"},{"bom_ref":"bifrost-clients","copyright":"Copyright Bifrost contributors","license_expression":"GPL-3.0-only","modified":true,"notice":"Bifrost client source and corresponding installation information are bundled with the release source archive.","purl":"pkg:generic/bifrost-clients","source":"repos/bifrost-clients"},{"bom_ref":"meta-rules-dat@4178770badecb1b349fbcd62c737e0d7a2079729","copyright":"Copyright MetaCubeX/meta-rules-dat contributors and upstream rule-data contributors","license_expression":"GPL-3.0-only","modified":false,"notice":"GeoSite.dat and geoip.metadb are pinned to release 393387661 published 2026-09-22; the generator source tree remains commit 4178770badecb1b349fbcd62c737e0d7a2079729 and both asset/source SHA-256 values are release-bound.","purl":"pkg:generic/meta-rules-dat@4178770badecb1b349fbcd62c737e0d7a2079729","source":"https://github.com/MetaCubeX/meta-rules-dat/tree/4178770badecb1b349fbcd62c737e0d7a2079729"},{"bom_ref":"mihomo@1.19.30","copyright":"Copyright MetaCubeX/mihomo contributors","license_expression":"GPL-3.0-only","modified":false,"not